tweet,date_time,real_distilbert_sentiment,real_sentiment
"“@dudek619: This should go down for a ""REALITY. GUEST SPOT EMMY AWARD NOMINATION!"" if there is such a category! LOVED IT!” Ha. She is great.",07/01/2015 15:44,joy,positive
I just found out my wife once dated @KeithUrban. Tough week for me.  https://t.co/4uaXBwFgFo,07/01/2015 15:32,neutral,neutral
I am so embarrassed.,07/01/2015 15:29,joy,positive
Nicole Kidman shares the embarrassing story of the first time we met #DidntKnowItWasADate http://t.co/aq1DumHPFK #FallonTonight,07/01/2015 15:24,neutral,neutral
I had a pretty crazy realization with Nicole Kidman on the show tonight. You should watch. Fun show. #FallonTonight,07/01/2015 00:55,neutral,neutral
"Girl Scouts has a new cookie called Rah-Rah Raisins. Even Jehovah’s Witnesses said, ""If the doorbell rings, say we're not home."" #fallonmono",07/01/2015 00:23,neutral,neutral
"Tonight: Playing Box of Lies with Nicole Kidman, @pattonoswalt stops by, and music from @warondrugsjams! #FallonTonight",06/01/2015 16:03,joy,positive
"Bradley Cooper shows his air guitar skills playing @Neilyoung's ""Down By The River"" https://t.co/GSywF7dVUp #FallonTonight",06/01/2015 15:13,neutral,neutral
Mark Zuckerberg's New Year resolution is to read more. Tom from Myspace's is to find a new Barnes &amp; Noble to take sink baths in. #fallonmono,06/01/2015 01:27,joy,positive
"New year, new shows! Back tonight with Bradley Cooper, @harryconnickjr, and @BIGKRIT ft. @RaphaelSaadiq! Don't miss! #FallonTonight",05/01/2015 16:07,joy,positive
Props to @bigsean for introducing me to @e40's music. Currently listening to Choices (Yup). #arseniooo #yoda,01/01/2015 22:27,neutral,neutral
Happy New Year!! I'm typing this now because later it would've been... Hoppu ber yeart!! #2015 #2016FIRST,31/12/2014 22:08,joy,positive
“@falpal_sarah: @jimmyfallon Merry Christmas Jimmy! Your show every night is the best present ever :)” Merry Christmas to you!,25/12/2014 05:32,joy,positive
@zellerfred happy everything my friend.,25/12/2014 05:30,joy,positive
“@Oprah: From our front porch to yours @jimmyfallon #HolidaySpirit http://t.co/BJPcLOcGgQ” That's a good looking family!,23/12/2014 20:06,joy,positive
"Another new show tonight! The great @JerrySeinfeld doing stand-up, @onedirection returns to talk &amp; music from @BigSean. #FallonTonight",23/12/2014 17:11,joy,positive
New classroom instruments with @onedirection!! Happy holidays! https://t.co/JBfJBIUM8V #1D #Fallon1D #SantaClausIsComingToTown,23/12/2014 16:12,joy,positive
"We have a live, brand new, fresh show to offer tonight!!! Hope you like it!! Fuuuuuuuuuun.",23/12/2014 04:15,joy,positive
"Ouija Boards are one of the year’s most popular toys. You know, because it wasn't bad enough talking to your LIVING relatives. #fallonmono",23/12/2014 03:36,joy,positive
"Me, 1D &amp; the Roots. #Fallon1D http://t.co/bsTHguK3EF",22/12/2014 22:10,joy,positive
Finally! Me and 1D! The Roots! Classroom instruments!! Tonight! #Fallon1D http://t.co/hSpvs0pNuU,22/12/2014 21:51,neutral,neutral
Actually - 5 special guests tonight on the show. #FallonTonight,22/12/2014 20:48,joy,positive
"Tonight: Playing Battleshots with Chris Pine! Plus David Oyelowo is here, 
cooking with @bflay &amp; some special guests stop by! #FallonTonight",22/12/2014 16:58,joy,positive
Congrats to @StephenAtHome and everyone at the Colbert Report. Fantastic end to a fantastic show. See you soon!,19/12/2014 19:01,joy,positive
"Happy #ThankYouNoteFriday! Tonight on the show: Ben Stiller (@redhourben), Brie Larson, and stand-up from @DamonkWayans! #FallonTonight",19/12/2014 16:25,joy,positive
"Obama said his favorite movie of the year was “Boyhood,"" because he identifies with aging several years over a couple hours.#fallonmono",19/12/2014 00:37,joy,positive
What ever happened to fun?!?!! Comedians in Cars Getting Coffee -@cicgcshow with me and @JerrySeinfeld: Part 1: http://t.co/WjnIPis9QY,18/12/2014 17:20,joy,positive
"Tonight: Amy Adams, @Nick_Offerman, and @foofighters are all here! Plus your funniest #ChristmasFail tweets! #FallonTonight",18/12/2014 16:06,neutral,neutral
"As part of a new diplomatic relationship, Cuba released one of our prisoners today, and we sent back one of their shortstops. #fallonmono",18/12/2014 01:30,joy,positive
"One year, my dad broke my toy the night before and on Christmas morning said, ""I guess it came broken."" #ChristmasFail",17/12/2014 21:22,joy,positive
Hashtag game! Tweet out something funny or embarrassing that happened to you on Christmas and tag with #ChristmasFail. Could be on our show!,17/12/2014 21:21,neutral,neutral
"So excited about tonight's guests. @PaulMcCartney is here, then talk + music from @itstonybennett and @ladygaga! #FallonTonight",17/12/2014 16:43,neutral,neutral
.@jtimberlake and I returned to #CampWinnipesaukee last night http://t.co/Lq4MxVQxBC #FallonTonight,17/12/2014 15:32,neutral,neutral
“@stevegarfield: Camp Winnipesaukee - YouTube. #FallonTonight  https://t.co/lCOZTZioQq” whoa - @stevegarfield? This must be viral...,17/12/2014 14:18,joy,positive
"Hey @jtimberlake, thanks for those camp memories. #CampWinnipesaukee #Fun #ThirdEyeBlind",17/12/2014 04:52,joy,positive
"It's the first night of Hanukkah, that special time you learn your friend is Jewish by asking what they're doing for Christmas. #fallonmono",17/12/2014 02:54,joy,positive
"Tonight on the show: Christoph Waltz is here, plus talk + music from @NICKIMINAJ! #FallonTonight",16/12/2014 16:17,joy,positive
.@Oprah and I get auto tuned. https://t.co/z54UrNqunv #FallonTonight #MidnightMeadows,16/12/2014 16:08,neutral,neutral
Props to my man Oscar Blandi (@OscarBlandi) for the holiday cut! #grazie http://t.co/hCkYT0JCpw,16/12/2014 15:48,joy,positive
.@Oprah and I share a few clips from the 80's soap opera we starred in  https://t.co/vilk6kIsTJ #FallonTonight,16/12/2014 15:07,joy,positive
"Obamacare ads will now appear on some 7-Eleven receipts. But for the ENTIRE Affordable Healthcare Act, check your CVS receipts. #fallonmono",16/12/2014 02:09,joy,positive
.@Oprah I'm still laughing from tonight!! Thanks again. You are FUN!,16/12/2014 00:56,joy,positive
"Fun show tonight. Excited to have @Oprah stopping by, plus @IdinaMenzel performs! #FallonTonight",15/12/2014 16:08,neutral,neutral
"Thank you, holiday cards, for giving me an annual update on how ugly my friends' kids are getting. #thankyounotefriday",13/12/2014 01:16,joy,positive
Happy #ThankYouNoteFriday! Tonight: Martin Freeman and Megan Mullally are here! Plus music from @YusufCatStevens. #FallonTonight,12/12/2014 16:14,joy,positive
Dwayne Johnson (@TheRock) and I have an Intense Staredown http://t.co/r2xg86soFV #FallonTonight,12/12/2014 15:04,neutral,neutral
"So Dick Cheney might not have known the location of CIA detention facilities. ""Part of the thrill was finding them on my own!"" #fallonmono",12/12/2014 02:20,joy,positive
Tonight: Dwayne Johnson (@therock) and @BarbaraJWalters are here! Plus @rickyrozay performs &amp; your #HanukkahSongs tweets. #FallonTonight,11/12/2014 16:18,joy,positive
"The Ragtime Gals cover Marvin Gaye's ""Sexual Healing"" with a little help from @stevecarell http://t.co/TdNTka8Io8 #FallonTonight",11/12/2014 14:54,neutral,neutral
"Ebola was 2014's most popular U.S. Facebook topic. The World Cup was 6th. So in America, even ebola's more popular than soccer. #fallonmono",11/12/2014 00:31,joy,positive
Forgot About Dreidel #HanukkahSongs,10/12/2014 23:04,joy,positive
"That’s the way, uh-huh uh-huh, I latke! #HanukkahSongs",10/12/2014 23:02,neutral,neutral
"Hashtag game! Tweet out a funny song lyric or song title about
Hanukkah and tag with #HanukkahSongs. Could be on our show!",10/12/2014 23:01,neutral,neutral
"Tonight on the show: @mark_wahlberg is here, plus talk &amp; stand-up from @kevin_nealon! #FallonTonight",10/12/2014 16:04,neutral,neutral
Lip Flip returns with the always hilarious @RickyGervais https://t.co/I6TC2lbBM3 #FallonTonight,10/12/2014 15:07,neutral,neutral
A new extra-large tablet computer is the size of a small TV. It's the perfect gift for every idiot in front of you at a concert. #fallonmono,10/12/2014 00:31,joy,positive
Tonight: Lip Flip returns with @rickygervais! Plus @StevieVanZandt is here and @iLoveMakonnen5D performs. #FallonTonight,09/12/2014 16:05,joy,positive
"South Korea is putting up a 30-foot Christmas tree at its border. Not to be outdone, North Korea let an elf rule its country. #fallonmono",09/12/2014 04:10,neutral,neutral
"We're back with new shows! Tonight: @ChrisRock is here, plus talk + music from @CarrieUnderwood. #FallonTonight",08/12/2014 16:04,joy,positive
I know the cast of Peter Pan worked hard for the performance tonight. Go get 'em! Break a leg. #NeverGrowUp,04/12/2014 23:49,neutral,neutral
Franny sends her thanks.,03/12/2014 23:46,joy,positive
"No,seriously! Seriously! Ew! Ew! Right? Right? Ew! @EW!  http://t.co/S908EHNvUQ http://t.co/1PTyLetkRs",03/12/2014 13:35,joy,positive
Have a great night!! @BWilliams &amp; @theroots bring back the slow jam http://t.co/win6EHSSMO #BW10 #FallonTonight,03/12/2014 04:09,joy,positive
"The larger the age difference between married couples, the more likely they divorce. Or as gold diggers call that, “The point.” #fallonmono",03/12/2014 00:32,neutral,neutral
Tonight: @RWitherspoon and David Sedaris are here! Plus @RaeSremmurd performs with @TheRoots. #FallonTonight,02/12/2014 16:09,joy,positive
Such an honor to be a guest on Jiminy Glick's show http://t.co/lgHWRiycmK #FallonTonight,02/12/2014 14:57,neutral,neutral
"The “Star Wars: The Force Awakens” teaser came out. It's 88 seconds long, but Star Wars fans only lasted about five seconds. #fallonmono",02/12/2014 01:13,joy,positive
So many fun surprises on the show tonight! Also - I've got some water retention that I'm really looking forward to telecast.,01/12/2014 17:41,joy,positive
Tonight: Pictionary with Martin Short and some special guests. Plus @itsgabrielleu stops by and music from @MaryJBlige! #FallonTonight,01/12/2014 16:05,neutral,neutral
.@iamrashidajones and I sing holiday parodies of this year's biggest hits http://t.co/otJqHMF8S0 #FallonTonight,28/11/2014 20:34,joy,positive
Happy Thanksgiving! #IJustNeedAMinute,28/11/2014 05:50,joy,positive
"Thank you, Thanksgiving, for being a time for family. And thank you, football and alcohol, for making that tolerable. #ThankYouNotes",28/11/2014 01:50,joy,positive
"Happy Thanksgiving! Tonight: @WhoopiGoldberg, @iamrashidajones, &amp; cooking w/@tomcolicchio! Plus Thanksgiving #ThankYouNotes. #FallonTonight",27/11/2014 18:45,joy,positive
Show your cousins how cool you are by watching YouTube clips from us! http://t.co/WANfkzGKGh Subscribe!,27/11/2014 18:22,neutral,neutral
We have a new Tonight Show after the game - be sure to watch. Rashida Jones and I have a holiday medley prepared! #FallonTonight,27/11/2014 14:11,joy,positive
Happy Thanksgiving!!,27/11/2014 14:10,joy,positive
"A storm could delay East Coast travel. I won't say the drive looks bad, but the traffic report said to “bring empty bottles.” #fallonmono",27/11/2014 03:51,joy,positive
"Tonight: Christopher Walken, @NickJonas, and a performance from @IggyAzalea! #FallonTonight",26/11/2014 15:57,joy,positive
"The Hunger Games inspired 29 couples to name their kids Katniss. Those born when The Hobbit came out said, “You got off easy.” #fallonmono",26/11/2014 00:25,neutral,neutral
Tonight: Bill O'Reilly is stopping by the show. Plus talk + music from @Lordemusic. #FallonTonight,25/11/2014 16:02,joy,positive
Tonight on the show: Tim Allen (@ofctimallen) and @iamwill are stopping by! Plus music from @DeJLoaf. #FallonTonight,24/11/2014 16:21,neutral,neutral
@Bease11 Good man. Thanks for bring awesome.,22/11/2014 05:00,joy,positive
"Thank you, turkeys, for being really well-fed this week and probably thinking, ""Man, November is the best."" #thankyounotefriday",22/11/2014 00:23,joy,positive
"Tonight: @_juliannemoore and Michael Cera are here! Plus @KidRock performs, and it's #ThankYouNoteFriday! #FallonTonight",21/11/2014 16:15,joy,positive
".@MarkRuffalo, @StephenMerchant, &amp; I play a game of Musical Beers https://t.co/H7HjkZ1w2B  #FallonTonight",21/11/2014 15:26,neutral,neutral
People said the President came off as strong and decisive tonight. Then they switched from Scandal to see what Obama had to say. #FallonMono,21/11/2014 02:39,joy,positive
Tonight: Playing a new game w/@MarkRuffalo &amp; @stephenmerchant! Plus @romeosantospage performs &amp; your #ThanksgivingFail tweets #FallonTonight,20/11/2014 15:59,joy,positive
"House Republicans picked an all-male group of new committee chairs. And they've got a pretty good name: ""No Direction."" #fallonmono",20/11/2014 00:37,neutral,neutral
My grandma bought a Butterball turkey and put it in the oven with the plastic bag still inside. #ThanksgivingFail,19/11/2014 21:22,joy,positive
Hashtag game! Tweet out something funny or embarrassing that happened on Thanksgiving and tag with #ThanksgivingFail. Could be on our show!,19/11/2014 21:22,neutral,neutral
Tonight: Jon Stewart and @PadmaLakshmi are here! Plus stand-up from @JimGaffigan. #FallonTonight,19/11/2014 15:57,neutral,neutral
“@rustyrockets: “ Played our craziest game of Word Sneak yet with the Russy B http://t.co/Bd8EgGOAJo #FallonTonight” I won.” Rematch?,19/11/2014 15:16,neutral,neutral
Played our craziest game of Word Sneak yet with the Russell Brand (@RustyRockets) http://t.co/Bd8EgGOAJo #FallonTonight,19/11/2014 15:08,joy,positive
"Marlins player Giancarlo Stanton signed a $325 million, 13-year deal. Asked what he'll do now, he said, ""Maybe buy the Marlins."" #fallonmono",19/11/2014 02:30,joy,positive
“@ddlovato128: Just a bday package sent from LESTER HOLT!!!! #DATELINESNUGGIE?!???  Jealous Jimmy? 😝 http://t.co/rZj3arW62h” Completely!,18/11/2014 23:55,joy,positive
Props to my man @Mariobatali for coming to the show tonight. You are a talented and fun human being. #batali,18/11/2014 18:50,neutral,neutral
Tonight: Playing Word Sneak with Russell Brand (@rustyrockets)! Plus @BrookeShields and @Mariobatali stop by. #FallonTonight,18/11/2014 16:03,joy,positive
Benedict Cumberbatch and I played a new game on the show last night: Three-Word Stories https://t.co/bxfPLuJ9Z9 #FallonTonight,18/11/2014 15:06,joy,positive
"Kim Kardashian's going to India for their version of “Big Brother.” If you're gonna break the Internet, that’s the place to be. #fallonmono",18/11/2014 01:37,joy,positive
No @U2 this week. But we'll think of something and send vibes to Bono for a speedy recovery.,17/11/2014 15:30,joy,positive
I don't know if the @Colts mascot is behind this but I think it's hilarious. Sad truth - it's actual size. http://t.co/glGXrfgruo #BigHead,17/11/2014 01:59,neutral,neutral
“@seliciap: @jimmyfallon can I call you james?” Sure!,15/11/2014 05:15,neutral,neutral
“@5sosftfallon: @jimmyfallon do you like pears 🍐” yep,15/11/2014 05:15,neutral,neutral
“@jensatts: @jimmyfallon meaning to ask you how big is your truck?” Big enough. #f🐔50,15/11/2014 05:15,joy,positive
“@danielinsomniac: @jimmyfallon am I cool?” Yes.,15/11/2014 05:12,neutral,neutral
“@chrisholmez: @jimmyfallon adopt me” no.,15/11/2014 05:05,neutral,neutral
“@lilkittens: I think @jimmyfallon walks better in heels than I do” not easy. #notjealous,15/11/2014 05:04,joy,positive
“@geewhizzle: @jimmyfallon When's the last time you had pizza?” Today. Harry's. It was great.,15/11/2014 05:03,neutral,neutral
“@Billie_Jean26: @jimmyfallon I'm at a bar. What song should I request?!” Ew! By http://t.co/LLH1VaMBEt,15/11/2014 05:01,neutral,neutral
“@SniperK78: @jimmyfallon U2 U2 U2! Will be outstanding.” For real. The album is really great. #U2onFallon,15/11/2014 04:59,joy,positive
“@TheMavrovic: @jimmyfallon you have inspired me to be your successor.” I dare you.,15/11/2014 04:59,neutral,neutral
Next week: U2 week. No joke. They are going for it. Love! #u2,15/11/2014 04:55,joy,positive
“@stephriebe: @jimmyfallon so great! I'm watching!” Told ja!,15/11/2014 04:45,joy,positive
"“@marchingonn: I don't have a television, Jimmy.  I live in a dorm. I'm sorry. I've failed you.” You are all my pals. No need for tv.",15/11/2014 04:44,joy,positive
“@AlexisTheWanted: @jimmyfallon my brother stole the TV control from me.” He's a bully. Get it back!,15/11/2014 04:39,joy,positive
“@Krazy4BrunoMars: @jimmyfallon im have tiredness” can't stop you. C'mon Miley!!,15/11/2014 04:39,joy,positive
“@justinecashew: @jimmyfallon I'm peeing” you've got time.,15/11/2014 04:37,neutral,neutral
“@tinagibala: @jimmyfallon Heck yeah!!!!!” Yahoooooooo!!,15/11/2014 04:35,neutral,neutral
“@BS_Triton: @jimmyfallon no” come on.,15/11/2014 04:35,neutral,neutral
Watching? NBC? Now? #FALLONTONIGHT,15/11/2014 04:34,joy,positive
"Thank you, New York, for being Ebola-free…just in time for my in-laws to feel safe enough to visit me for Thanksgiving. #thankyounotefriday",15/11/2014 00:17,neutral,neutral
"Tonight: @LiamHemsworth, @KatieHeigl &amp; stand-up from Sebastian Maniscalco (@SebastianComedy). Happy #ThankYouNoteFriday! #FallonTonight",14/11/2014 16:20,joy,positive
Hey @jhutch1992. How's your day? I'm just gettin' my Starbucks. So sad. #Frappuccino,14/11/2014 15:42,neutral,neutral
Josh Hutcherson (@jhutch1992) and I play an intense game of Beer Hockey http://t.co/4APToU7IaE #FallonTonight,14/11/2014 14:55,joy,positive
"Apparently Kim Kardashian didn't get paid for her racy Paper Magazine photos, but she does have a good deal on the back-end. #fallonmono",14/11/2014 00:47,neutral,neutral
"Tonight: Playing Beer Hockey w/@jhutch1992! Plus Tracey Ullman is here, @Echosmith performs, &amp; your #MyFamilyIsWeird tweets. #FallonTonight",13/11/2014 16:55,joy,positive
Box of Lies with @ChanningTatum http://t.co/KaWPgVKENQ #FallonTonight,13/11/2014 16:26,neutral,neutral
"Randy Jackson's leaving “American Idol."" Said he wanted to go out when the show was on top, but decided to wait another 7 years. #fallonmono",13/11/2014 00:53,joy,positive
"My aunt wore sneakers to my sister's wedding, but brought her heels just to show everyone she had them. #MyFamilyIsWeird",12/11/2014 21:29,joy,positive
"Hashtag game! Tweet a funny, weird or embarrassing thing a family member has done or said &amp; tag with #MyFamilyIsWeird. Could be on our show!",12/11/2014 21:29,neutral,neutral
Tonight on the show: @channingtatum and Eddie Redmayne are here! Plus @Logic301 performs with @TheRoots. #FallonTonight,12/11/2014 16:10,neutral,neutral
"""Wanna Spritz?"" with @DrewBarrymore http://t.co/8OKLtUCKpf #FallonTonight",12/11/2014 15:01,neutral,neutral
"Valerie Jarrett is being referred to as the “Obama Whisperer.” Not surprisingly, the “Biden Whisperer” is Cesar Millan. #fallonmono",12/11/2014 00:30,joy,positive
Tonight on the show: @DrewBarrymore is here! Plus @farrellybros stop by and @Johnny_Marr performs. #FallonTonight,11/11/2014 16:20,joy,positive
.@Nickjonas and I take on @Jeff_Daniels and @Usher in a game of Pyramid http://t.co/4t4ywAxTYz #FallonTonight,11/11/2014 15:17,neutral,neutral
"George W. Bush said there's a 50% chance his brother Jeb runs in 2016. Then he said, “But there's an 80% chance he won't."" #fallonmono",11/11/2014 00:39,joy,positive
Tonight: Playing Pyramid with @Jeff_Daniels and some surprise guests. Plus @mackenziefoy is here and @newbsmnttapes performs. #FallonTonight,10/11/2014 16:14,joy,positive
Thank you Boston! Thank you @denisleary @CamNeelyFdn. Thank you Monica's! #comicscomehome #TDGarden #NorthEnd http://t.co/GEPvik1zLE,09/11/2014 05:44,neutral,neutral
See you soon Boston!! #comicscomehome,08/11/2014 17:38,joy,positive
"Thank you, encores, for being a band's way of saying, ""We're making you beg us to play the only song you came to see."" #thankyounotefriday",07/11/2014 23:40,joy,positive
Really fun show tonight. @jayleno returns to The Tonight Show to talk &amp; perform stand up!! Don't miss! #FallonTonight #FallonLeno,07/11/2014 16:07,joy,positive
Currently obsessed with Willie's Roadhouse on Sirius XM 59. Doing a great job over there! Thanks.,07/11/2014 15:52,neutral,neutral
.@McConaughey and I play Facebreakers  http://t.co/uWVnJDBh04  #FallonTonight,07/11/2014 14:50,joy,positive
"Utah made history by electing Mia Love to Congress. She is a black female Republican Mormon. Even Unicorns said ""Not buying it."" #FallonMono",07/11/2014 00:34,joy,positive
"Tonight: Playing Facebreakers with @McConaughey! Plus @BethBehrs stops by, @iamtovelo performs &amp; your #IfIWasInCharge tweets. #FallonTonight",06/11/2014 16:08,joy,positive
"In case you missed: @StevieNicks performs an acoustic version of ""Rhiannon"" http://t.co/2HFWkNdGUw Get her new album: http://t.co/FZS81VMzvQ",06/11/2014 15:31,neutral,neutral
Lip Flip Duet with @BetteMidler  http://t.co/mduIEUAHDH #FallonTonight,06/11/2014 15:00,joy,positive
"Republicans won the Senate, gaining 7 seats. They haven't had this many seats since Chris Christie made an airline reservation. #fallonmono",06/11/2014 01:15,joy,positive
Pringles cans would be twice as wide so I could actually fit my hand inside them. #IfIWasInCharge,05/11/2014 21:29,joy,positive
"Hashtag game! Tweet a funny, weird or interesting new law you'd pass if you got elected and tag with #IfIWasInCharge. Could be on our show!",05/11/2014 21:28,neutral,neutral
"Fun show tonight. @bettemidler is here to talk and perform, plus @JimGaffigan stops by! #FallonTonight",05/11/2014 16:02,neutral,neutral
Obama spent Election Day in closed-door meetings at the White House. Nice to see some doors actually closed at the White House. #fallonmono,05/11/2014 00:56,neutral,neutral
"Tonight: Playing ""Pop Quiz"" with @SavannahGuthrie and @MLauer! Plus Felicity Jones and music from @FKAtwigs. #FallonTonight",04/11/2014 16:14,joy,positive
"Experts say Mary Keitany's NYC Marathon was one of the most impressive races they've seen a woman run. Hillary says ""stay tuned.""#fallonmono",04/11/2014 01:14,neutral,neutral
"Big news for our Latin American fans! Starting tonight, our show will be airing weeknights on @OnDIRECTV. Hope you watch!",03/11/2014 21:01,joy,positive
"Tonight: Anne Hathaway, @GaelGarciaB, World Series MVP Madison Bumgarner and music from @StevieNicks! #FallonTonight",03/11/2014 16:05,neutral,neutral
"Thank you, neighbors that give out apples on Halloween, for basically saying, ""Here: Throw this at our house later."" #thankyounotefriday",31/10/2014 23:10,joy,positive
Happy Halloween! #DIYHalloween #RamenNoodle http://t.co/ovTjntiOQH,31/10/2014 19:26,joy,positive
Tonight: Playing Wheel of Impressions with @KevinSpacey. Then @OliviaMunn and @lucasbros stop by &amp; it's #ThankYouNoteFriday! #FallonTonight,31/10/2014 15:19,neutral,neutral
.@ChrisRock surprises our audience to share this year's Top 5 Halloween Costumes http://t.co/xISKntfvA1 #FallonTonight #TopFiveMovie,31/10/2014 13:52,joy,positive
"Apple CEO Tim Cook officially came out as gay. But knowing Apple, a new Tim Cook will probably come out next week. #fallonmono",30/10/2014 23:58,joy,positive
Tonight on the show: @GordonRamsay is here! Plus some smart kids show off their inventions and @littlebigtown performs. #FallonTonight,30/10/2014 15:09,joy,positive
Water War returns with Jake Gyllenhaal! http://t.co/Llqlk2CQJN #FallonTonight,30/10/2014 14:22,neutral,neutral
The man investigating the Secret Service prostitution scandal got caught with a prostitute. So Obama appointed an Irony Czar. #fallonmono,29/10/2014 22:39,joy,positive
Tonight: Water War with Jake Gyllenhaal! Plus Paul Reubens (@peeweeherman) is here and music from @sheandhim. #FallonTonight,29/10/2014 15:01,joy,positive
"Daniel Radcliffe raps through all of @blackalicious_'s ""Alphabet Aerobics"" https://t.co/WfvXXjWPM5 #FallonTonight",29/10/2014 14:10,neutral,neutral
“@KittyOKelley: This music does have an old school sound. Feel like I should or a drink!  #FallonTonight” he's good. Sturgill Simpson,29/10/2014 04:34,joy,positive
"#tyson answer: yes, for a second - I was scared.",29/10/2014 04:25,joy,positive
#TysonOnTyson #MikeTysonsPunchout,29/10/2014 04:23,joy,positive
“@KellyHylandSTL: #PeeSheets! @jimmyfallon and @MikeTyson You just made me laugh so hard I wet my pants. Now I have #PeePants” diPici's!,29/10/2014 04:21,fear,neutral
#tysonPunchOut #rappngRadcliffe,29/10/2014 04:18,neutral,neutral
“@Shannondf: @jimmyfallon THAT did not disappoint! WOW! #DanielRadcliffe” yaaay!! I told you!?!!,29/10/2014 04:11,neutral,neutral
Now! NBC! Watch! #DanielRadcliffe,29/10/2014 04:05,neutral,neutral
I'm telling you - watch now!! It will be trending and he's phenomenal. #NBC #DanielRadcliffe #FallonTonight #Blackalicious #insanity,29/10/2014 04:02,joy,positive
Daniel Radcliffe does something fantastic on the show tonight. You have to watch! #FallonTonight,29/10/2014 01:04,joy,positive
Starbucks is coming out with a Chestnut Praline Latte. Sounds less like a drink and more like a stripper giving her full name. #fallonmono,28/10/2014 23:41,joy,positive
Here’s one of our writers @patrickborelli in his DIY Middle-Aged Mutant Ninja Turtle costume. #FallonCostume http://t.co/4QCUvjbDaC,28/10/2014 20:58,joy,positive
"Hey guys! Post a pic of your fun &amp; clever DIY Halloween costume, tell us what it’s called &amp; tag with #FallonCostume. Could be on our show!",28/10/2014 20:57,neutral,neutral
"Tonight on the show: Daniel Radcliffe is doing something fun, @MikeTyson stops by, and @SturgillSimpson performs. #FallonTonight",28/10/2014 15:16,joy,positive
Charles Barkley and I play Charades against @mcgregor_ewan and @jefftweedy http://t.co/p1vtd9Omlx #FallonTonight,28/10/2014 14:41,neutral,neutral
Got my pumpkins this weekend! #PumpkinTruck #BigEnough http://t.co/UleLbl826R,28/10/2014 00:19,joy,positive
