tweet,date_time
"""We've emerged from what was a once-in-a-generation crisis, better positioned for the future than any of our competitors."" —President Obama",18/03/2015 19:07
"""Since I took office, we've cut our deficits as a share of our economy by about two-thirds."" —President Obama",18/03/2015 19:02
"""More than 16 million Americans have gained the security of health care coverage."" —President Obama",18/03/2015 19:00
"""The typical family this year should save more than $700 at the pump."" —President Obama",18/03/2015 18:59
"""Every three weeks we produce as much solar power as we did in all of 2008.""  —President Obama",18/03/2015 18:57
"""Today there are more job openings in the United States than any time since 2001."" —President Obama",18/03/2015 18:57
"""We're now in the midst of the longest streak of private-sector growth on record."" —President Obama",18/03/2015 18:56
"""America's businesses have added more than 200,000 jobs each month for 12 straight months."" —President Obama",18/03/2015 18:55
"""Do we retreat from the realities of a 21st century economy, or do we advance together?""—President Obama",18/03/2015 18:54
LIVE: President Obama speaks at the City Club of Cleveland about the importance of middle-class economics. http://t.co/JvJtGuIwTL,18/03/2015 18:47
"Tune in at 2:55 p.m. ET to watch President Obama talk about middle-class economics in Cleveland, Ohio. http://t.co/4mJWJXjxIP",18/03/2015 17:51
Read the President's reply to a high school student's letter about the unequal distribution of school supplies: http://t.co/Lfi8mSsS4f,18/03/2015 16:23
Happy Saint Patrick's Day. http://t.co/i2hxSFrYGB,17/03/2015 18:27
WATCH: President Obama discusses #CollegeOpportunity with students from across the country. http://t.co/nfa7wPavgW,17/03/2015 16:37
"Before this round ends, help decide who advances in the Climate Change Fantasy Tournament: http://t.co/O2fR9gnCxk #ChampionDenier",16/03/2015 21:00
"Thanks to #Obamacare, 16.4 million more Americans have the security of health coverage. http://t.co/BY6k3y3dZ2",16/03/2015 17:10
"In the weekly address, President Obama lays out his plan for quality, affordable higher education for all Americans: http://t.co/HlBdGKnxYl",14/03/2015 13:47
Read how the Obama administration is fighting state bans on same-sex marriage: http://t.co/uAjlQQ5jho #LoveIsLove,13/03/2015 21:51
Time to weigh in—who deserves the #ChampionDenier title? http://t.co/Fyyz0hLnez,13/03/2015 17:09
For real though: http://t.co/mjoOt7YfVz #CanILive,13/03/2015 15:31
"We've already tripled wind energy in America, but there's more we can do. http://t.co/elImYrEShN #SwitchToClean",12/03/2015 21:33
Who will take home the title of #ChampionDenier? Vote now: http://t.co/hFWKz1uKEf http://t.co/l8TGDshzIg,12/03/2015 19:37
ICYMI: Nearly 11.7 million Americans enrolled in health care through the open marketplace. http://t.co/tNREJaKtvH,11/03/2015 00:46
"Solar power is growing at record rates, supporting American jobs and helping fight climate change: http://t.co/oTBPdkIBRH #SwitchToClean",10/03/2015 22:32
We're making big strides in combating climate change—but more can be done. #ActOnClimate http://t.co/VOhJDGMtMH,10/03/2015 20:54
"""No matter who you are or where you come from, not only can you succeed, but you can help everybody else succeed."" —President Obama",10/03/2015 18:21
"""Inspire us. Lead us. Be the Americans that we need you to be."" —President Obama #CollegeOpportunity",10/03/2015 18:21
"""Change doesn't happen by itself. It happens because people get organized."" —President Obama",10/03/2015 18:18
"""You're not just investing in yourself—you're investing in your nation."" —President Obama #CollegeOpportunity",10/03/2015 18:14
"""We're trying to make sure that across the board more and more young people can afford to go to college."" —President Obama",10/03/2015 18:13
"""I sent Congress a bold new plan to bring down the cost of community college to zero."" —President Obama #CollegeOpportunity",10/03/2015 18:10
"""I'm only standing here because of scholarships and loans and work study."" —President Obama #CollegeOpportunity",10/03/2015 18:08
"""I believe America is not a place where higher education is a privilege reserved for the few."" —President Obama #CollegeOpportunity",10/03/2015 18:07
"""The ability to compete in the global economy depends on us having the world's most skilled, best educated workforce.""  —President Obama",10/03/2015 18:05
"""Your most valuable asset is your imagination."" —President Obama #CollegeOpportunity",10/03/2015 18:04
"""Today a college degree is the surest ticket to the middle class."" —President Obama #CollegeOpportunity",10/03/2015 18:02
"""After the worst economic crisis of our lifetimes, over the past five years our economy has created 12 million new jobs."" —President Obama",10/03/2015 18:01
"""I believe that higher education is one of the best investments anybody can make in their future."" —President Obama #CollegeOpportunity",10/03/2015 18:00
LIVE: President Obama is talking to students at @GeorgiaTech about how to make college in America more affordable. http://t.co/8Nb4gVygp2,10/03/2015 17:53
Tune in at 1:30 p.m. ET to watch President Obama discuss college affordability at @GeorgiaTech: http://t.co/SFwboCIk9b,10/03/2015 16:36
Watch President Obama and @FLOTUS reflect on their visit to Selma: http://t.co/ROj1LJXoGh #Selma50,09/03/2015 15:43
"""Women make immeasurable contributions to our world."" —President Obama #HappyInternationalWomensDay http://t.co/IcllNqPgcR",08/03/2015 23:07
"""We honor those who walked so we could run. We must run so our children soar."" —President Obama #Selma50 #MarchOn",07/03/2015 20:58
"""What a glorious task we are given, to continually try to improve this great nation of ours."" —President Obama #Selma50 #MarchOn",07/03/2015 20:56
"""We respect the past, but we don’t pine for the past. We don’t fear the future."" —President Obama #Selma50 #MarchOn",07/03/2015 20:54
"""We know America is what we make of it."" —President Obama #Selma50 #MarchOn",07/03/2015 20:52
"""We can make sure every person willing to work has the dignity of a job, and a fair wage, and a real voice."" —President Obama #Selma50",07/03/2015 20:50
"""With effort, we can roll back poverty and the roadblocks to opportunity."" —President Obama #Selma50 #MarchOn",07/03/2015 20:49
"""This is work for all Americans, and not just some. Not just whites. Not just blacks."" —President Obama #Selma50 #MarchOn",07/03/2015 20:47
"""Selma teaches us, too, that action requires that we shed our cynicism."" —President Obama #Selma50 #MarchOn",07/03/2015 20:45
"""If Selma taught us anything, it’s that our work is never done."" —President Obama #Selma50 #MarchOn",07/03/2015 20:43
"""Young people can draw strength from this place, where the powerless could change the world’s greatest power."" —President Obama #Selma50",07/03/2015 20:41
"""That’s what this movement was all about—one leg in our long journey toward freedom."" —President Obama #Selma50 #MarchOn",07/03/2015 20:39
"""What greater form of patriotism is there than the belief that America is not yet finished."" —President Obama #Selma50 #MarchOn",07/03/2015 20:37
"""What could be more American than what happened in this place?"" —President Obama #Selma50 #MarchOn",07/03/2015 20:35
"""They proved that nonviolent change is possible. That love and hope can conquer hate."" —President Obama #Selma50",07/03/2015 20:33
"""What enormous faith these men and women had—faith in God, but also faith in America."" —President Obama #Selma50",07/03/2015 20:31
"""It was not a clash of armies, but a clash of wills; a contest to determine the true meaning of America."" —President Obama #Selma50",07/03/2015 20:30
"""There are places and moments in America where this nation’s destiny has been decided ... Selma is such a place."" —President Obama #MarchOn",07/03/2015 20:27
LIVE: President Obama is speaking at the Edmund Pettus Bridge on the 50th anniversary of the Selma marches. http://t.co/8JypQTMQFo #Selma50,07/03/2015 20:18
"Tune in at 2:35 p.m. ET to watch President Obama speak in Selma, Alabama: http://t.co/wF2J5vKpRY #MarchOn http://t.co/COHzBaUleZ",07/03/2015 18:56
WATCH: President Obama discusses the need to encourage the education of girls around the globe. http://t.co/vtisyocnkt #LetGirlsLearn,07/03/2015 15:23
"Learn about the legacy of Selma, listen to stories from courageous civil rights activists, and #MarchOn: http://t.co/YR0mks1ORz",06/03/2015 22:57
LIVE: President Obama is participating in a town hall at @BenedictEDU about youth opportunities. http://t.co/l1rEKQHzkY,06/03/2015 19:11
"Our economy added 295,000 jobs last month—that's a record 60 consecutive months of private-sector job growth: http://t.co/t0cG7USZcN",06/03/2015 17:07
The number of uninsured Americans continues to drop within the first two months of 2015: http://t.co/E2HVFlRx3k,05/03/2015 18:53
The unemployment rate dropped in every single state during 2014—the first time that's happened in 30 years. http://t.co/1ngUD95daI,05/03/2015 16:19
President Obama's progressive trade deal would mean stronger protections for workers and the environment: http://t.co/qpF2biBTpJ,04/03/2015 21:14
"If you're passionate about marriage equality, take a look at this progress—state by state: http://t.co/f9T7HxIk3H #LoveIsLove",04/03/2015 16:28
"""Every girl deserves an education."" —President Obama #LetGirlsLearn http://t.co/9L7MTiYog6",03/03/2015 22:27
LIVE: President Obama and @FLOTUS discuss expanding efforts to help #LetGirlsLearn around the world. http://t.co/TfhhouKtpU,03/03/2015 20:02
"""Throughout history, extraordinary women have fought tirelessly to broaden our democracy's reach."" —President Obama #WomensHistoryMonth",02/03/2015 23:12
The excuses not to #ActOnClimate need to end. http://t.co/B5WMlIYGjc,02/03/2015 16:36
"In the weekly address, the President talks about ensuring that all hard-working Americans can retire with dignity. http://t.co/fAEEiGTX9Z",28/02/2015 21:33
Six hours until a Homeland Security shutdown. #EnoughAlready—time to pass the bipartisan funding bill now.,27/02/2015 22:41
"""Long before being nerdy was cool, there was Leonard Nimoy."" —President Obama #LLAP",27/02/2015 21:39
We can't govern from crisis to crisis. Add your name if you support a long-term plan to #FundDHS: http://t.co/XEdo1TVpad #EnoughAlready,27/02/2015 20:54
"""You shouldn't feel like you can't make mistakes at this point."" —President Obama to Noah McQueen http://t.co/qYODkrfFOr #MyBrothersKeeper",27/02/2015 18:56
"Great news: Today, the @FCC voted in favor of a free and open internet. http://t.co/CfSxpVyqxd #NetNeutrality",26/02/2015 22:17
Missed the #ObamaTownHall on immigration reform last night? Watch it here: http://t.co/HBzeHGTwOk,26/02/2015 19:31
IMPORTANT: Congress is only one day away from another shutdown. #EnoughAlready http://t.co/xz5DwiZ3Ef,26/02/2015 16:24
We're just two days away from another shutdown—your voice matters more than ever. Add your name: http://t.co/BCsbHIV3cc #EnoughAlready,25/02/2015 22:31
Consumer protections for retirement savings are critical for middle-class families. Read why: http://t.co/4NzNDUEm4v (via @DispatchAlerts),25/02/2015 18:37
Tell new congressional leaders #EnoughAlready—no more manufactured crises over politics: http://t.co/oo3AmsIq4J,25/02/2015 16:06
ICYMI: A comprehensive immigration reform bill sat on Speaker Boehner's desk for more than 500 days. #EnoughAlready,24/02/2015 21:05
Some in Congress would choose not to fund @DHSgov rather than fix our broken immigration system. #EnoughAlready,24/02/2015 19:03
"""It's time to end the era of manufactured crises."" —President Obama on #ImmigrationAction http://t.co/yWQLxIl1Cc",24/02/2015 17:17
Let congressional leaders know that another shutdown is the last thing we need. Add your name now: http://t.co/y4ayySH3dV #EnoughAlready,23/02/2015 23:25
Reminder: The debate in Congress right now is supposed to be about funding the Department of Homeland Security. #EnoughAlready,23/02/2015 21:29
LIVE: President Obama is talking about how strengthening retirement security is good for the middle class. http://t.co/tcc8b52RUA,23/02/2015 19:06
"Only two months on the job, the new Congress is already threatening a partial government shutdown. #EnoughAlready http://t.co/8OX0MCxbzc",23/02/2015 18:07
"In the weekly address, the President discusses opening new markets to grow the economy and support good-paying jobs: http://t.co/iQPq7eWjfe",22/02/2015 01:18
Every day is #LoveYourPetDay. http://t.co/yxrIDz3gU6,20/02/2015 20:55
Here are eight ways #Obamacare has proved the critics wrong: http://t.co/kjxbQXoraW (h/t @voxdotcom),20/02/2015 18:29
It's more than health insurance—it's peace of mind. http://t.co/nBIJv0evNk,19/02/2015 23:05
LIVE: The President announces new national monuments and an initiative to protect the nation's unique outdoor spaces. http://t.co/KyWNB87mKy,19/02/2015 20:00
"""Trade has an important role to play in supporting good-paying, middle-class jobs in the U.S."" —President Obama http://t.co/521E9s0SB4",19/02/2015 16:42
Too many lawmakers still deny the science of climate change. Call them out now: http://t.co/qlquFqhsA6 #ActOnClimate http://t.co/MbzTx9Wz3E,18/02/2015 23:39
The Affordable Care Act is helping millions of families—we can't go back now. http://t.co/OWOxJreB2m,18/02/2015 15:43
The deadline is here. Go #GetCoveredNow: http://t.co/xTRj74V0N6 http://t.co/ykQVuz3NC8,16/02/2015 01:07
Last call for health insurance this year: http://t.co/1jOkVIuE0L #GetCoveredNow,15/02/2015 17:52
"""Nothing will determine our success as a nation in the 21st century more than how well we educate our kids."" http://t.co/LD1A7FBBDH",14/02/2015 23:32
Get it done today: http://t.co/4Z0Bzqjrfn http://t.co/UNJMlJRYsa,14/02/2015 19:07
"In the weekly address, the President lays out his plan to ensure more kids graduate from school ready for the future: http://t.co/dMEJG0KJ6Y",14/02/2015 16:49
Just like your favorite romantic comedies—but with benefits: http://t.co/60fxgyjsry #GetCoveredNow,14/02/2015 00:19
The United States can make real progress on climate change. Read more from @Podesta44: http://t.co/WZArcVM0IN,13/02/2015 21:53
LIVE: President Obama is speaking at the White House #CyberSummit at @Stanford. http://t.co/CXo6EhiiVk,13/02/2015 19:34
Make sure your loved ones are covered: http://t.co/SWjS2289uU #GetCoveredNow http://t.co/xGHVrBHovH,13/02/2015 17:01
Speaking of #YOLO: http://t.co/gHVJID0tvP,12/02/2015 23:27
"So, this happened: http://t.co/bVx7fyDEl3 #CanILive",12/02/2015 23:08
No more games—Congress should stop the political posturing and make progress on immigration. #EnoughAlready http://t.co/LH2npSuNR4,12/02/2015 18:33
Three days left: http://t.co/qHVxbtrGnU #GetCovered http://t.co/LNfpXIp470,12/02/2015 17:18
Happening now: President Obama discusses taking action against ISIL. http://t.co/HarnB4wWMb,11/02/2015 20:38
The President discusses the importance of health care and marriage equality progress in his interview with @BuzzFeed: http://t.co/EGKNHMWp8J,11/02/2015 18:33
"Of all the things you do today, getting covered before the enrollment deadline could be the most crucial: http://t.co/3uAVMQWgm4 #GetCovered",11/02/2015 17:14
It's the final countdown: Only five days left in the enrollment period. #GetCovered now. http://t.co/iToBPhVVmy http://t.co/hYgwhVrPa7,10/02/2015 21:13
It's time to #GetCovered. Watch: http://t.co/EpFCypkQWH,10/02/2015 19:39
Joshua got covered so that he could stay healthy—without worrying about expensive premiums. http://t.co/RSnykzs9Xf,09/02/2015 23:01
Repealing the Affordable Care Act would mean millions of Americans could lose their health insurance: http://t.co/LnUNqKlZSw,09/02/2015 20:46
"President Obama sat down with @voxdotcom to discuss health care, the economy, and America's position in the world: http://t.co/5JIJ23wiWH",09/02/2015 19:06
Watch the message that aired tonight during the #Grammys from President Obama: #ItsOnUs to stop sexual assault. http://t.co/xytAN7mSyW,09/02/2015 02:54
"Watch: In the weekly address, President Obama highlights the country's economic progress. http://t.co/r7fV6DJL2p",07/02/2015 19:00
Watch: These people are why the Affordable Care Act matters. http://t.co/dousOukeLQ,06/02/2015 22:25
"""Let's roll up our sleeves, work together, and try to get something done."" —President Obama",06/02/2015 20:01
"""I'm not pushing these ideas for my sake. I'm pushing them because I think this is where America needs to go."" —President Obama #Leadership",06/02/2015 19:56
"""At a time when the economy is picking up speed and growing again, we've got to work twice as hard."" —President Obama",06/02/2015 19:53
"""I want to make sure that this is a country where hard work is rewarded."" —President Obama",06/02/2015 19:52
"""We have risen from recession, freer to write our own future than any nation on earth."" —President Obama",06/02/2015 19:52
"""America is poised for another good year... as long as Washington works to keep this progress going."" —President Obama",06/02/2015 19:47
"""And, in the single most hopeful sign for middle-class families, wages are starting to go up again."" —President Obama",06/02/2015 19:46
"""Over the past 59 months, the private sector has added almost 12 million new jobs."" —President Obama",06/02/2015 19:44
"""In 2014, our economy created 3.1 million jobs—and that's the best year of job growth since the 1990s."" —President Obama",06/02/2015 19:43
LIVE: The President answers questions from students and faculty at Ivy Tech Community College in Indianapolis. http://t.co/v84rVrP58Z,06/02/2015 19:31
Tune in at 2:15 p.m. ET to watch President Obama take questions from students on jobs and education at a town hall: http://t.co/jOMmTxPlUt,06/02/2015 18:36
"The economy added 257,000 jobs in January, part of the strongest three-month growth since 1997. Let's keep it going: http://t.co/bXXbvC1n6k",06/02/2015 15:56
Good news: Wind and solar energy have tripled since 2008. http://t.co/osh3AsFWqB,05/02/2015 22:24
WATCH: No one's invincible. http://t.co/gDzSSCx1G5 #GetCovered,05/02/2015 20:31
"Jake has coverage he can count on, for less than he expected. #GetCovered http://t.co/NjJhUDnUiR",05/02/2015 17:06
The last chance to #GetCovered for 2015 is only days away. Find a plan today: http://t.co/4lQezMBknb http://t.co/oTh6b92jJ1,04/02/2015 23:01
"Today, President Obama met with young immigrants whose lives are positively affected by #ImmigrationAction. http://t.co/bmYOO4TKwb",04/02/2015 19:54
Not that much time left to #GetCovered: http://t.co/nf95N0Umwf,04/02/2015 18:38
"Check out President Obama's comprehensive budget plan, and see how he's investing in middle-class families: http://t.co/gUcWhfu36y",02/02/2015 20:05
"""We have to pass a budget that gives middle-class families the security they need to get ahead in the new economy."" —President Obama",02/02/2015 16:48
LIVE: President Obama discusses how his budget will bring middle-class economics into the 21st century. http://t.co/9Y8HDe9GIE,02/02/2015 16:40
"""I will keep doing everything I can to help more working families make ends meet and get ahead."" —President Obama http://t.co/exNWiYdigT",31/01/2015 21:16
"In the weekly address, President Obama lays the foundation for focusing on middle-class economics: http://t.co/wOAIO5wiLj",31/01/2015 15:54
Check getting covered off of your to-do list. Find a plan that works for you before the February 15th deadline: http://t.co/rV08U27qC2,30/01/2015 22:58
"Climate change deniers, take note: The vast majority of Americans agree that it's time to #ActOnClimate. http://t.co/KTqwd2GQCV",30/01/2015 19:53
Happening now: President Obama speaks about investing in precision medicine to improve health and disease treatment. http://t.co/uf2kRxhxe5,30/01/2015 16:19
"Six years ago, the President signed the Lilly Ledbetter Fair Pay Act—but the fight for equal pay is far from over. http://t.co/isSTQvlWZ1",30/01/2015 00:12
Parents will always worry about their kids. Give them some peace of mind—#GetCovered today. http://t.co/DGuJEY9TwF #YoEnroll,29/01/2015 22:58
Get a state-by-state breakdown on how much the President's #ImmigrationAction will benefit the economy: http://t.co/Lo8J5Q83Ul,28/01/2015 20:49
9.5 million Americans have signed up for coverage—and we're not done yet. http://t.co/sMCzitJ9zX,27/01/2015 22:48
.@VP stops by @TheEllenShow with a message for young adults: Give your mom some peace of mind and #GetCovered. http://t.co/MqMOsk9bWK,26/01/2015 22:30
"If you need health insurance, find a plan that's right for you right now: http://t.co/0UFJ8hjXWt #GetCovered",26/01/2015 18:03
"""People want to see an agenda that moves us all forward."" Read President Obama's latest message to @OFA: http://t.co/AvnSlvXzD9",26/01/2015 16:44
Watch the weekly address: We have to do everything we can to help more Americans get ahead in the new economy. http://t.co/78fbwjSDoQ,24/01/2015 18:52
"""Somewhere, the sun is shining, the air is fresh, his team's behind him, and Mr. Class—'Mr. Cub'—is ready to play two."" —President Obama",24/01/2015 16:52
LIVE: President Obama is speaking at the U.S. Conference of Mayors. Watch here: http://t.co/1VYEZxI1sE,23/01/2015 21:54
These senators are at odds with 97% of climate scientists and NASA. #ActOnClimate http://t.co/zYUuwl7AFb,23/01/2015 20:41
Watch: Don't be THAT person. Stop waiting around and #GetCovered today. http://t.co/JpjjF56nUh,23/01/2015 15:57
"""I am deeply committed to protecting this core constitutional right."" —President Obama on the 42nd anniversary of #RoevWade",22/01/2015 23:28
"Happening now: President Obama is being interviewed by @YouTube stars Bethany Mota, GloZell Green and Hank Green. http://t.co/zuQTNEQ40d",22/01/2015 22:09
Read President Obama's latest message to @OFA supporters after his State of the Union address: http://t.co/0wx6bFgQ6b,22/01/2015 21:00
Find out which senators just went on the record to say that man-made climate change isn't real: http://t.co/Nbeqct6iHG #ActOnClimate,22/01/2015 19:41
LIVE: President Obama is speaking at @KUNews about middle-class economics. Tune in: http://t.co/DAJMCOnFQ1,22/01/2015 17:34
Next stop: Kansas. Tune in at 12:25 p.m. ET to watch President Obama talk about middle-class economics. http://t.co/m4PValiRjb,22/01/2015 17:06
"LIVE: A day after his State of the Union address, President Obama is in Idaho spekaing at @BoiseStateLive. Tune in: http://t.co/gDQwNgjSf3",21/01/2015 22:04
President Obama is doing what he can to fight for middle-class families. Take a stand on this: http://t.co/fChzMIQOlZ,21/01/2015 19:39
It's #BigBlockOfCheeseDay: Check out the schedule of White House staff answering your questions. http://t.co/g2EKBztnvL,21/01/2015 17:41
Let's go. http://t.co/G7wWN15opl,21/01/2015 03:43
"""Let’s begin this new chapter—together—and let’s start the work right now."" —President Obama #SOTU #AmericaLeads",21/01/2015 03:16
"""My fellow Americans, we too are a strong, tight-knit family. We, too, have made it through some hard times."" —President Obama #SOTU",21/01/2015 03:15
"""I want future generations to know that we are a people that see our differences as a great gift."" —President Obama #SOTU",21/01/2015 03:12
"""If you share the broad vision I outlined tonight, join me in the work at hand."" —President Obama #SOTU #AmericaLeads",21/01/2015 03:10
"""It’s possible to shape a law that upholds our tradition as a nation of laws and a nation of immigrants."" —President Obama #SOTU",21/01/2015 03:08
Retweet if you agree: #LoveIsLove. #SOTU http://t.co/rDiOb8I6w1,21/01/2015 03:08
"""I’ve seen something like gay marriage go from a wedge issue used to drive us apart to a story of freedom."" —President Obama #SOTU",21/01/2015 03:07
"""I know the good, and optimistic, and big-hearted generosity of the American people."" — President Obama #SOTU",21/01/2015 03:04
"""I still believe we are one people. I still believe that together, we can do great things, even when the odds are long."" —President Obama",21/01/2015 03:04
"""I know how tempting such cynicism may be. But I still think the cynics are wrong."" —President Obama #SOTU",21/01/2015 03:02
"""Leading — always — with the example of our values. That’s what makes us exceptional. That’s what keeps us strong."" — President Obama #SOTU",21/01/2015 03:01
"""I will not let this Congress endanger the health of our children by turning back our efforts."" —President Obama #SOTU #ActOnClimate",21/01/2015 02:57
"""14 of the 15 warmest years on record have all fallen in the first 15 years of this century."" —President Obama #SOTU #ActOnClimate",21/01/2015 02:56
"""No challenge poses a greater threat to future generations than climate change."" —President Obama #SOTU #ActOnClimate",21/01/2015 02:55
The science is clear: We have to #ActOnClimate. #SOTU http://t.co/G0cTqYub9q,21/01/2015 02:53
"""When what you're doing hasn't worked for 50 years, it's time to try something new."" —President Obama #SOTU",21/01/2015 02:50
"""We need a tax code that truly helps working Americans trying to get a leg up in the new economy."" —President Obama #SOTU",21/01/2015 02:45
"""When it comes to issues like infrastructure and basic research, I know there’s bipartisan support in this chamber."" —President Obama #SOTU",21/01/2015 02:45
"""21st century businesses will rely on American science, technology, research and development."" —President Obama #SOTU",21/01/2015 02:43
"""Let’s pass a bipartisan infrastructure plan that could create more than 30 times as many jobs per year.” —President Obama #SOTU",21/01/2015 02:43
"""To every CEO in America: If you want someone who will get the job done and done right, hire a veteran."" —President Obama #SOTU",21/01/2015 02:40
