tweet,date_time,real_distilbert_sentiment,real_sentiment
"Tonight: @MichaelKeaton, @ninadobrev, music from @The_xx, and more! #FallonTonight",17/01/2017 13:47,joy,positive
.@michaelstrahan and @BryceDHoward take on @questlove and I in an intense game of Pyramid https://t.co/dWm11VmAKj #FallonTonight,17/01/2017 12:55,joy,positive
"Tonight on the show: @michaelstrahan and Bryce Dallas Howard are here, plus @BebeRexha performs! #FallonTonight",16/01/2017 14:10,joy,positive
Can't believe we were just in LA a few days ago!! Busy and fun times! https://t.co/VPwSYHIso7,13/01/2017 23:23,joy,positive
Rumors circulating that @TheKinks actually owned a @Toyota Corolla -not a Camry. https://t.co/WmqTu8xEFY #Lola,13/01/2017 17:40,neutral,neutral
"Tonight: Claire Danes, J.K. Simmons, music from @sampha and it's #ThankYouNoteFriday! #FallonTonight",13/01/2017 14:01,joy,positive
First Drafts of Rock: Lola by @TheKinks -- Thanks again @KevinBacon! https://t.co/WmqTu8xEFY #FallonTonight,13/01/2017 13:04,joy,positive
A special @FLOTUS edition of #ThankYouNotes https://t.co/XIo9FSNfor #FallonTonight,12/01/2017 19:05,joy,positive
"Tonight: New First Drafts of Rock w/@kevinbacon, Greta Gerwig, stand-up from @nickthune &amp; your #ResolutionFail tweets! #FallonTonight",12/01/2017 14:06,joy,positive
"Stevie Wonder performs ""Isn't She Lovely"" &amp; ""My Cherie Amour"" in a special medley for @FLOTUS https://t.co/alrsYiuH6f #FallonTonight",12/01/2017 13:37,joy,positive
Last night we helped @FLOTUS surprise people who thought they were recording goodbye messages to her https://t.co/NDTdUd6uBX #FallonTonight,12/01/2017 13:15,joy,positive
My friend’s resolution was to text less. I know that because he texted it to me. #ResolutionFail,11/01/2017 17:03,neutral,neutral
Hashtag game! Tweet out a funny or embarrassing way you've broken a New Year's Resolution &amp; tag with #ResolutionFail. Could be on our show!,11/01/2017 17:02,joy,positive
Great show tonight: @FLOTUS Michelle Obama is here!! Plus talk &amp; music with the legendary Stevie Wonder! Don't miss!! #FallonTonight,11/01/2017 13:47,joy,positive
"Tried a new game on the show last night with @IAMQUEENLATIFAH, @waynecoyne, and Fred Armisen! https://t.co/4Uo0I9DK02 #FallonTonight",11/01/2017 13:01,joy,positive
"We're back with new episodes!! Really fun show tonight: @IAMQUEENLATIFAH
Fred Armisen, and music from @theflaminglips! #FallonTonight",10/01/2017 13:47,joy,positive
My fav too!! https://t.co/qP4TYgMsL2,09/01/2017 23:18,joy,positive
The opening: how it happened. https://t.co/HMsA4sVxg9,09/01/2017 21:06,neutral,neutral
@ChristianSlater you know you are one of my favorite actors ever. I loooooove you!!!,09/01/2017 21:01,joy,positive
Check out Snapchat to see behind the scenes of how we put the Golden Globes opening together! Thanks again for last night.,09/01/2017 20:27,joy,positive
Do NOT miss the opening 5 minutes of the Golden Globes tonight on NBC. Tune in at 7:59 (east coast) 4:59 (west) if you have to!,08/01/2017 22:47,joy,positive
Everybody's talking about the GG's!! #GiantsGame #GoldenGlobes  🏈,08/01/2017 18:08,joy,positive
Good morning from LA. This Sunday 8pm ET #GoldenGlobes https://t.co/fnric2WO2Z,06/01/2017 17:17,neutral,neutral
Jim Parsons and I play 5-Second Summaries  https://t.co/gANCJSI8Id #FallonTonight,23/12/2016 13:30,joy,positive
"Tonight: Adam Driver, @rhettandlink, music from @rkelly, #ThankYouNoteFriday and our final day of #12DaysOfChristmasSweaters! #FallonTonight",23/12/2016 13:14,joy,positive
"Tonight: Jim Parsons, Toy Experts @EvanTubeHD &amp; Jillian, music from @dec99th, your #NewXmasCarols tweets &amp; #12DaysOfChristmasSweaters!",22/12/2016 13:51,joy,positive
Best Friends Challenge with @violadavis https://t.co/jW72tsUMFM #FallonTonight,22/12/2016 12:52,joy,positive
You better watch out / You better not cry / You better not pout I'm telling you why / I'm filming you on Snapchat right now #NewXmasCarols,21/12/2016 20:30,neutral,neutral
"Hashtag game! Update the lyrics of a famous Christmas song to be more modern, and tag with #NewXmasCarols. Could be on our show!",21/12/2016 20:29,joy,positive
https://t.co/5CGEisTVa0,21/12/2016 19:47,neutral,neutral
"Thanks to @PaulMcCartney, @McConaughey, @RWitherspoon, Scarlett Johansson, @SethMacFarlane &amp; @torikelly!!… https://t.co/v64NeKB7gz",21/12/2016 15:12,joy,positive
"Tonight's show: @violadavis, @nickkroll and Chef Daniel Humm! Plus #12DaysOfChristmasSweaters continues! #FallonTonight",21/12/2016 14:04,joy,positive
"New Kid Theater! @McConaughey and I perform kid-written scripts for ""Gold"" https://t.co/VOw9JCAr3x #FallonTonight",21/12/2016 13:31,joy,positive
".@PaulMcCartney, the cast of @singmovie, @TheRoots, &amp; I sing an a cappella version of ""Wonderful Christmastime""  https://t.co/UkEGlM2bn1",21/12/2016 13:10,joy,positive
"Tonight: Kid Theater w/@McConaughey, @JanelleMonae is here, music from @SylvanEsso and Day 9 of #12DaysOfChristmasSweaters! #FallonTonight",20/12/2016 14:09,joy,positive
Denzel Washington and I give some dramatic readings of greeting cards https://t.co/mH4fi9E5f9 #FallonTonight,20/12/2016 13:13,joy,positive
"Tonight: Denzel Washington is here! Plus @itstonybennett stops by to talk &amp; perform, + #12DaysOfChristmasSweaters continues! #FallonTonight",19/12/2016 13:58,joy,positive
"Tonight: @RWitherspoon, @AndrewRannells, music from @_Warpaint + #12DaysOfChristmasSweaters &amp; #ThankYouNoteFriday! #FallonTonight",16/12/2016 13:54,joy,positive
"Taking the Ramen Challenge with Sienna Miller, with a little surprise from the @Rockettes! https://t.co/hKPRDoYpT4 #FallonTonight",16/12/2016 13:09,joy,positive
"Tonight: Casey Affleck, Sienna Miller, music from @solangeknowles, your funniest #CrappyHolidays tweets + #12DaysOfChristmasSweaters!!",15/12/2016 13:56,joy,positive
.@Schwarzenegger and I have a Snapchat Interview https://t.co/n4zDdheCwW #FallonTonight,15/12/2016 12:55,joy,positive
My friend got caught in a snowstorm driving home. He spent Christmas at a Red Roof Inn eating cold omelets from the buffet. #CrappyHolidays,14/12/2016 21:30,sadness,negative
"Hashtag game! Tweet out a funny, weird, or embarrassing holiday story that happened to you &amp; tag with #CrappyHolidays. Could be on the show!",14/12/2016 21:29,joy,positive
"Tonight: @Schwarzenegger &amp; Elle Fanning stop by, plus Childish Gambino (@donaldglover) performs &amp; #12DaysOfChristmasSweaters! #FallonTonight",14/12/2016 13:54,joy,positive
Michael Fassbender and I have an Air Guitar Battle https://t.co/LZ6Syju36t #FallonTonight,14/12/2016 13:01,joy,positive
"Tonight on the show: Michael Fassbender, Jon Glaser, @NiallOfficial performs and more #12DaysOfChristmasSweaters! #FallonTonight",13/12/2016 14:02,joy,positive
"Tonight: @BryanCranston, @HaileeSteinfeld, music from @OneRepublic, and #12DaysOfChristmasSweaters! #FallonTonight",12/12/2016 14:01,joy,positive
I can't believe we pulled that off. I lost it. #FallonTonight,10/12/2016 06:15,joy,positive
"Happy #ThankYouNoteFriday! Tonight: @TheRock, @kevin_nealon, music from @GaryClarkJr and #12DaysOfChristmasSweaters continues!",09/12/2016 14:09,joy,positive
I created these Hands High @NFL sweatshirts to enhance the experience of being a fan. https://t.co/Ht9FQTnX3i… https://t.co/VWTxXGx8Yf,09/12/2016 00:04,joy,positive
"Tonight: Robert De Niro, @Pharrell Williams stops by to talk and perform with @KimBurrellLove, your #TextFail tweets &amp; more! #FallonTonight",08/12/2016 14:00,joy,positive
Here's Nintendo legend Shigeru Miyamoto playing the Super Mario Bros theme w/@TheRoots! So cool!! https://t.co/7qKPdU0hUp #FallonTonight,08/12/2016 13:16,joy,positive
Debuted the new Nintendo Switch last night with President of @NintendoAmerica Reggie Fils-Aimé!! https://t.co/su8GAQRrCM #FallonTonight,08/12/2016 12:58,joy,positive
"Friend was texting his mom when the restaurant texted him to say his table was ready. He accidentally replied ""Thanks, love you."" #TextFail",07/12/2016 18:46,neutral,neutral
"Hashtag game! Tweet out a funny, weird, or embarrassing story about texting and tag with #TextFail. Could be on our show!",07/12/2016 18:45,joy,positive
"Tonight on the show: @EdwardNorton, @rizmc, and a demo with President of @NintendoAmerica Reggie Fils-Aimé! Don't miss! #FallonTonight",07/12/2016 13:58,joy,positive
.@prattprattpratt and I perform Mad Lib Theater https://t.co/isOUmdLHbv #FallonTonight,07/12/2016 12:56,joy,positive
Cooking and laughing with @Mariobatali and @VICE https://t.co/Zv3SZ24xnt #Munchies,06/12/2016 15:53,joy,positive
"Fun show tonight: Mad Lib Theater with @prattprattpratt, @KatieHolmes212 is here, and @JohnMayer performs! #FallonTonight",06/12/2016 13:58,joy,positive
"#HamiltonMixtape performance on the show last night with @BustaRhymes, @JoellOrtiz, @blackthought &amp; @theroots!! https://t.co/xuBtWilPnO",06/12/2016 13:35,joy,positive
"Tonight Show Family Feud w/Annette Bening, @IAmSteveHarvey, Greta Gerwig &amp; the Roots! So much fun https://t.co/sp8XDOoa63 #FallonTonight",06/12/2016 13:04,joy,positive
#FallonTonight is trending... so fun!!,06/12/2016 05:08,joy,positive
https://t.co/1pHC8xnIIz #HamiltonMixtape #Track12 #LoopIt #Spotify  https://t.co/1pHC8xnIIz,06/12/2016 04:42,neutral,neutral
#HamiltonMixtape tonight on #Tonight!,06/12/2016 04:20,joy,positive
"Tonight: Annette Bening, @IAmSteveHarvey + music from #HamiltonMixtape's @BustaRhymes, @JoellOrtiz, @blackthought &amp; @theroots #FallonTonight",05/12/2016 14:00,joy,positive
"Congrats to @Lin_Manuel, @questlove, @blackthought and all else who worked so hard on #HamiltonMixtape. Honored. https://t.co/0XH0FqZ6bB",02/12/2016 17:23,joy,positive
"Tonight's show: Charades with @chelseahandler, @johnlegend stops by to talk &amp; perform and it's #ThankYouNoteFriday! #FallonTonight",02/12/2016 14:02,joy,positive
Emma Stone and I play the Singing Whisper Challenge https://t.co/r41t9httHQ #FallonTonight,02/12/2016 13:07,joy,positive
My first headshot. 1992. #TBT https://t.co/NIN0xSB0kr,01/12/2016 19:41,neutral,neutral
"Fun show tonight: Emma Stone, @JDMorgan, music from @KaceyMusgraves, and your funniest #OfficePartyFail tweets! #FallonTonight",01/12/2016 14:02,joy,positive
Two guys used fire extinguishers and pretended to be Ghostbusters. #OfficePartyFail,30/11/2016 19:50,neutral,neutral
Hashtag game! Tweet out something funny or embarrassing that happened at an office party &amp; tag with #OfficePartyFail. Could be on our show!,30/11/2016 19:49,joy,positive
"Tonight: Felicity Jones, Billy Crudup, music from @carseatheadrest, and new Audience Suggestion Box! #FallonTonight",30/11/2016 13:51,joy,positive
"Playing Password with Natalie Portman, J.J. Abrams, and @NeilDiamond! https://t.co/bbnHLKfUGv #FallonTonight",30/11/2016 13:02,joy,positive
"Hey guys, at 5pm we're live-streaming tonight's monologue on Facebook!",29/11/2016 21:51,joy,positive
"Fresh new shows all week long!!!! Tonight: Natalie Portman, J.J. Abrams and @NeilDiamond! #FallonTonight",29/11/2016 17:48,joy,positive
Gooooo Big Bird!!! #YellowFeather https://t.co/k8RFJb2ntm,29/11/2016 17:13,joy,positive
"Tonight: Playing Password with Natalie Portman, J.J. Abrams stops by, and @NeilDiamond performs! #FallonTonight",29/11/2016 14:02,joy,positive
"Tonight on the show: @FINALLEVEL, @alexisbledel, and music from @DavidGray! #FallonTonight",28/11/2016 14:02,joy,positive
Make your party plans now!! I'm hosting the Globes Jan. 8th. https://t.co/xbTm0vGS3Z,24/11/2016 17:42,joy,positive
Happy Thanksgiving!! Watching the parade with the NBC All Stars @SavannahGuthrie @MLauer and @alroker.,24/11/2016 15:29,joy,positive
"Happy Thanksgiving!! Brand new show for you tonight: @KevinJames, @TimGunn, music from @theweeknd, and Thank You Notes! #FallonTonight",24/11/2016 13:46,joy,positive
"Tonight on the show: Leslie Mann, Jonathan Groff, music from @machinegunkelly &amp; @camilacabello97, plus new #Fallonventions! #FallonTonight",23/11/2016 14:07,joy,positive
So much fun. Talking about @GilmoreGirls with my #GilmoreGirlsTop3 @ScottGPatterson @seangunn @liza_weil last night! https://t.co/cRdiL2QZ1a,23/11/2016 13:06,joy,positive
"It happened. My #GilmoreGirlsTop3 are on the show tonight!!
3. Luke  @ScottGPatterson 
2. Kirk  @seangunn 
1. Paris @liza_weil",23/11/2016 00:08,joy,positive
"Fun show tonight! @SJP, @GilmoreGirls' @scottGPatterson @liza_weil &amp; @seangunn, plus Frank Pellegrino Jr! #FallonTonight",22/11/2016 14:11,joy,positive
"Jason Sudeikis, @KChenoweth, @JoeJonas and I try a new game called Tandem Sculptionary https://t.co/Gxr5FjP0go #FallonTonight",22/11/2016 13:07,joy,positive
"Tonight: Tandem Sculptionary with Jason Sudeikis, @KChenoweth stops by and music from @DNCE! #FallonTonight",21/11/2016 13:53,joy,positive
"Tonight on the show: @megynkelly, @hardwick, a performance from @emelisande and it's #ThankYouNoteFriday! #FallonTonight",18/11/2016 13:55,joy,positive
Nicole Kidman and I have another awkward interview https://t.co/tcOyEk2wfz #FallonTonight,18/11/2016 13:00,neutral,neutral
Behind the scenes of filming our latest Tonight Show promo - you can catch it airing during #TNF tonight https://t.co/h1PuH1l5Wo,17/11/2016 18:57,joy,positive
Little known trivia for this: we shot this on our first take! https://t.co/YjG6HtzPSF #EnterSandman #Metallica,17/11/2016 18:10,joy,positive
"@Metallica, @theRoots and I play Enter Sandman with childhood instruments! https://t.co/YjG6Htif17 #HardwiredToSelfDestruct out Friday.",17/11/2016 14:16,joy,positive
"Tonight's show: Nicole Kidman, Michael Shannon, music from @mirandalambert and your #MyFamilyIsWeird tweets! Don't miss! #FallonTonight",17/11/2016 13:54,joy,positive
".@Metallica, @theroots &amp; I perform ""Enter Sandman"" w/Classroom Instruments!  https://t.co/xGEz6kyik2 #hardwiredtoselfdestruct #FallonTonight",17/11/2016 13:01,joy,positive
We filmed after our show aaaannd #HardwiredToSelfDestruct is out this Friday. https://t.co/JPtuNi9pio,17/11/2016 05:07,joy,positive
I can't believe we couldn't mention this for weeks!!???? So fun!! #HardwiredToSelfDestruct #FallonTonight https://t.co/Hil2ZJGPhs,17/11/2016 05:02,joy,positive
"My cousin told everyone he could do a backflip. We all gathered around him. He said, “I can’t do it if you’re watching.” #MyFamilyIsWeird",16/11/2016 18:42,neutral,neutral
"Hashtag game! Tweet out something funny, weird, or embarrassing about a family member and tag with #MyFamilyIsWeird. Could be on the show!",16/11/2016 18:41,joy,positive
"Tonight: Jude Law, @sterlingkb1, and music from @macklemore feat. @deboogirl! Plus doing something fun with @Metallica! #FallonTonight",16/11/2016 13:55,joy,positive
#GilmoreGirlsTop4 not allowed to say Rory or Lorelai 4.Taylor 3.Luke 2.Kirk https://t.co/FAQbrPmhXT Geller,16/11/2016 13:09,neutral,neutral
Shared my love of Gilmore Girls on the show last night. Tweet me your #GilmoreGirlsTop4!  https://t.co/mr9yiUIOD7,16/11/2016 12:54,joy,positive
Cannot wait to see what @DavidBlaine does tonight!#BeyondMagic,16/11/2016 01:05,joy,positive
"Tonight: Warren Beatty, @NaomieHarris, @r0bbier0berts0n, and music from @heyamine! #FallonTonight",15/11/2016 13:57,joy,positive
.@LittleBigTown and I play Stranger Strings https://t.co/Uiq6865m2O #FallonTonight,15/11/2016 13:03,joy,positive
"Tonight on the show: Billy Bob Thornton, @Andy,  music from @littlebigtown, and more! #FallonTonight",14/11/2016 14:00,joy,positive
What @davidblaine does on our show tonight is truly unreal. I've never seen anything - or will I ever - see anything like that EVER.,11/11/2016 23:43,joy,positive
"Fun show tonight: @Renner4Real, Michelle Dockery, @davidblaine performs, and it's #ThankYouNoteFriday! #FallonTonight",11/11/2016 14:07,joy,positive
Amy Adams and I play a singing version of Whisper Challenge https://t.co/AysMycc7Oa #FallonTonight,11/11/2016 13:00,joy,positive
"Tonight: Whisper Challenge w/Amy Adams, @Buck is here, music from Morgane &amp; @ChrisStapleton + your #NewWeedLaws tweets. #FallonTonight",10/11/2016 14:02,joy,positive
Eddie Redmayne and @lilycollins face off playing Know It All https://t.co/K0kQoPE3Hc #FallonTonight,10/11/2016 13:01,joy,positive
"Tonight on the show: Eddie Redmayne, @lilycollins, music from @WainBright, and new @NFL Superlatives. #FallonTonight",09/11/2016 14:02,joy,positive
.@aliciakeys and I have an intense staring contest https://t.co/8EqdrGXTFx #FallonTonight,08/11/2016 13:39,joy,positive
"Fun show tonight: @billmaher, @DaveedDiggs, players from #WorldSeries Champs @Cubs, and music from @whereisMUNA! #FallonTonight",07/11/2016 13:51,joy,positive
Come back next week!!! Congrats on new album #HERE https://t.co/M115pfTF5n,05/11/2016 04:00,joy,positive
This Snapchat video will be gone in 24 hrs. Instant Song Challenge with Justin Timberlake. https://t.co/ziAxIUUHlO #FALLON #Trolls,04/11/2016 14:25,joy,positive
"Tonight on the show: @danacarvey is here, @aliciakeys stops by to talk + perform ft @YoungMAMusic &amp; it's #ThankYouNoteFriday! #FallonTonight",04/11/2016 13:02,joy,positive
Benedict Cumberbatch and I perform a dramatic scene written with Mad Libs https://t.co/yEi7I8yBod #FallonTonight,04/11/2016 11:58,joy,positive
"Honored to perform ""You’ll Be Back"" with @TheRoots on  #HamiltonMixtape https://t.co/iBl9UO8wpg",03/11/2016 15:40,joy,positive
"Tonight on the show: Benedict Cumberbatch is here, @maddow stops by, music from @jimjames, and your #ThatHappened tweets! #FallonTonight",03/11/2016 14:41,joy,positive
Snapchat Instant Song Challenge with @jtimberlake will only be LIVE for 46 more hours. https://t.co/PgzLKsQ7DJ #FALLON,03/11/2016 13:59,joy,positive
I like that. https://t.co/wB2pi2fjH1,03/11/2016 13:52,neutral,neutral
Who should we have for the next Snapchat #SongChallenge? https://t.co/ziAxIVciKo  #Fallon,03/11/2016 13:28,joy,positive
#DemLaces or #FunkyDuck? #Fallon #SongChallenge https://t.co/ziAxIVciKo,03/11/2016 12:13,joy,positive
Right now - look for FALLON on Snapchat Discover tabs! @jtimberlake and I write songs based on your titles. #Fallon #SongChallenge,03/11/2016 12:10,joy,positive
Vince Vaughn and I have an Emotional Interview https://t.co/ukT52PS2vm #FallonTonight,03/11/2016 11:54,joy,positive
My favorite line so far... congrats VV! https://t.co/EpDVc2uTDM,03/11/2016 11:18,joy,positive
Watching World Series history with the Tonight Show fam. #FallonTonight #Game7 https://t.co/2uAW5DPm0w,03/11/2016 01:54,joy,positive
"I was driving on the highway, didn't see a car for 15 min. When I finally did see one, it was being driven by a clown. #ThatHappened",02/11/2016 17:52,neutral,neutral
I once went to a Prince concert and ended up dancing alone onstage with the band. #ThatHappened,02/11/2016 17:48,joy,positive
"Hashtag game! Tweet out something funny, weird, or embarrassing that happened to you and tag with #ThatHappened. Could be on our show!",02/11/2016 17:47,joy,positive
"Tonight: Vince Vaughn, @pattonoswalt, stand-up from @natebargatze, and new @NFL superlatives! #FallonTonight",02/11/2016 13:02,joy,positive
".@DonFranciscoTV and I sing a duet of ""To All The Girls I've Loved Before"" https://t.co/nC6dAFERPK #FallonTonight",02/11/2016 12:07,joy,positive
Get ready! We’re bringing The Tonight Show to @EOnlineUK starting tonight at 10pm. Can’t wait! #FallonTonightUK,01/11/2016 14:39,joy,positive
"Tonight: @WhoopiGoldberg, @ZoeListerJones, music from @lecrae ft @lalahhathaway and new Audience Suggestion Box! #FallonTonight",01/11/2016 13:05,joy,positive
.@jayleno tags in to tell a few jokes during last night's monologue https://t.co/D1CiQ7hKL1 #FallonTonight,01/11/2016 12:04,joy,positive
"Happy Halloween! Tonight on the show: @jayleno, @itsgabrielleu, and music from @BigSean! #FallonTonight",31/10/2016 13:08,joy,positive
"Happy #ThankYouNoteFriday! Tonight: @AnnaKendrick47, @JohnLithgow, stand-up from @iliza, and Kids Campfire stories! #FallonTonight",28/10/2016 13:59,joy,positive
Bumped into Martin Short and @SteveMartinToGo backstage before the show last night https://t.co/xT6RpNLrcW #FallonTonight,28/10/2016 12:31,joy,positive
"Thanks to @common, @BJTHECHICAGOKID and @TheRoots for this awesome performance https://t.co/FsIU8bq2uN #FallonTonight",28/10/2016 12:15,joy,positive
"No one puts the work into it like our guests @SteveMartinToGo, Martin Short, and our writer @beckyyk. If you enjoy silly pretapes: Fallon",28/10/2016 03:01,joy,positive
@common thank you. just... wow.,28/10/2016 02:57,joy,positive
He made the whole show crack up. All day long. Funtimes. https://t.co/sRA9PzJrQp,28/10/2016 00:26,joy,positive
I can't hit your high notes anymore! JT carried me. https://t.co/9bfHtjpAJ6,28/10/2016 00:20,neutral,neutral
Hayseed Dixie https://t.co/wO6kYJIm6z,28/10/2016 00:17,neutral,neutral
"Tonight: Martin Short &amp; @SteveMartinToGo, Ruth Negga, @common performs ft. @BJTHECHICAGOKID &amp; your #CrappyHalloween tweets! #FallonTonight",27/10/2016 13:03,joy,positive
.@jtimberlake and I return to Camp Winnipesaukee https://t.co/WD1H5GlaQc #FallonTonight #JTonFallon,27/10/2016 12:01,joy,positive
One year I jumped off the porch in a plastic Batman costume and ripped it immediately. It was the first house of the night. #CrappyHalloween,26/10/2016 18:03,neutral,neutral
Hashtag game! Tweet out a funny or embarrassing thing that happened to you on Halloween and tag with #CrappyHalloween. Could be on our show!,26/10/2016 18:03,joy,positive
"Tonight: @jtimberlake is here! Plus Tracey Ullman, music from @stanaj &amp; new @NFL Superlatives! Don't miss! #JTonFallon #FallonTonight",26/10/2016 13:05,joy,positive
"The legendary @PhilCollinsFeed performed ""In the Air Tonight"" on the show last night! (Nailed the drums @questlove!) https://t.co/S9tKtpwuGc",26/10/2016 11:56,joy,positive
Haaa. Thanks man. He killed it. (Both Phil and Quest) https://t.co/XSpdWxmsws,26/10/2016 11:36,joy,positive
"Tonight on the show: Ethan Hawke stops by, @PhilCollinsFeed is here to talk + perform, and more! #FallonTonight",25/10/2016 13:02,joy,positive
.@rickygervais and I take turns answering random questions from people in 30 Rock Plaza https://t.co/t5mPOz799I #FallonTonight,25/10/2016 11:57,joy,positive
"We're back with new shows tonight! @rickygervais, @evanrachelwood, and music from @michaelbuble! #FallonTonight",24/10/2016 12:46,joy,positive
I LOVED the performance by @QueensChristine last night. ICYMI: https://t.co/yCaiSeWwfs #FallonTonight,14/10/2016 20:29,joy,positive
"Tonight on the show: Doing something fun w/Jon Hamm, @ColleenB123 stops by, @KingsOfLeon performs &amp; it's #ThankYouNoteFriday! #FallonTonight",14/10/2016 12:58,joy,positive
.@KevinHart4real and I visit a haunted house https://t.co/OHLrpnavFZ #FallonTonight,14/10/2016 11:56,joy,positive
Happy Halloween from 2 @GibbBarry 's! https://t.co/hOdQkwtawA #BarryGibb #Halloween,13/10/2016 14:55,joy,positive
"Tonight: Vin Diesel, Norman Reedus (@wwwbigbaldhead), music from @QueensChristine, and your funniest #IOnceOverheard tweets! #FallonTonight",13/10/2016 13:00,joy,positive
".@GibbBarry and I harmonize Fall-themed words on ""Silhouette Singing"" https://t.co/hOdQkwtawA #FallonTonight",13/10/2016 12:00,joy,positive
"My friend overheard two women on the subway arguing which brand of
Rihanna's perfume smelled the most like her. #IOnceOverheard",12/10/2016 18:23,neutral,neutral
"Hashtag game! Tweet out something funny, weird or embarrassing you
overheard someone say and tag with #IOnceOverheard. Could be on the
show!",12/10/2016 18:23,joy,positive
"Tonight: @BryanCranston, Dakota Fanning, and something fun + music from the legendary @GibbBarry! Plus new @NFL Superlatives! #FallonTonight",12/10/2016 13:01,joy,positive
".@KevinHart4real and I play a game show version of ""Would You Rather"" https://t.co/MkdVCMpKIj #FallonTonight",12/10/2016 11:59,joy,positive
"Tonight: Playing a new game w/@KevinHart4real, @fleabag's Phoebe Waller-Bridge stops by, plus @JamesBayMusic performs. #FallonTonight",11/10/2016 13:05,joy,positive
.@TherealTaraji and I team up against @questlove and @blackthought in a game of Password https://t.co/WJX7avLbj4 #FallonTonight,11/10/2016 11:57,joy,positive
"Tonight: Playing Password with @TherealTaraji, @DavidKHarbour stops by, and music from @phish!",10/10/2016 13:02,joy,positive
@JimFKenney I'll take suggestions.,09/10/2016 16:32,neutral,neutral
Haaa. Youse. https://t.co/iWC0LNv2Bm,09/10/2016 16:25,joy,positive
"I'm off to Philly to work on my accent. Or the south? Or England? It's tricky, man. Love ya Philadelphia! #hewgie",09/10/2016 14:34,joy,positive
Thank you @nbcsnl and that great cast! Congrats to @Lin_Manuel and @twentyonepilots on a great show!!! #SNL,09/10/2016 14:32,joy,positive
"Tonight: @tylerperry, @abigailspencer, @vanmorrison, and it's #ThankYouNoteFriday!! #FallonTonight",07/10/2016 13:04,joy,positive
"New Kid Theater! @BenAffleck and I perform kid-written scripts for ""The Accountant"" https://t.co/Vl7dGi7OIP #FallonTonight",07/10/2016 12:10,joy,positive
I’m calling in in an half an hour. @nfl football hoodie HANDS HIGH. It’s should be fun! #TodaysSpecial https://t.co/TlQ7h7UkzL,07/10/2016 11:37,joy,positive
One of my all time favs - Billy Liar. https://t.co/zagG3M8qMy,07/10/2016 02:35,joy,positive
@HSN has a full day dedicated to the sweatshirt that I created: https://t.co/zyZm0pnixb I’m calling in tomorrow 8am.,07/10/2016 01:02,joy,positive
"Tonight: Kid Theater w/@BenAffleck, @MsSarahPaulson is here, music from @GreenDay and your funniest #MyDumbArgument tweets! #FallonTonight",06/10/2016 13:01,joy,positive
"Two of my friends once got into a fight over who could feel more human emotions, Robocop or the Terminator. #MyDumbArgument",05/10/2016 18:36,neutral,neutral
"Hashtag game! Tweet out a weird, funny, or stupid argument you or a friend has gotten into &amp; tag with #MyDumbArgument. Could be on the show!",05/10/2016 18:35,joy,positive
"Tonight: @aplusk, @IssaRae, music from @NorahJones, and new @NFL Superlatives! #FallonTonight",05/10/2016 13:05,joy,positive
